{
  "version": "infrastructure-node.v1",
  "request_id": "fixture-001",
  "node_id": "fixture-nas",
  "operation": "docker.logs",
  "params": {
    "container_id": "aaaaaaaaaaaaaaaaaaaaaaaaaaaaaaaaaaaaaaaaaaaaaaaaaaaaaaaaaaaaaaaa",
    "tail": 200,
    "since_seconds": 3600,
    "max_bytes": 65536
  },
  "timeout_ms": 10000
}
